"URL","SCOPUS_ID","TITLE","CREATOR","PUBLICATIONNAME","ISSN","EISSN","VOLUME","PAGERANGE","COVERDATE","COVERDISPLAYDATE","DOI","CITEDBY-COUNT","AGGREGATIONTYPE","SYBTYPE","SUBTYPEDESCRIPTION"
"http://api.elsevier.com/content/abstract/scopus_id/84884919538","SCOPUS_ID:84884919538","Brain is the predilection site of Toxoplasma gondii in experimentally inoculated pigs as revealed by magnetic capture and real-time PCR","Jur�nkov�, J.","Food Microbiology","07400020",,"38","167-170","2014-04-01","April 2014","10.1016/j.fm.2013.08.011","0","Journal","ar","Article"
"http://api.elsevier.com/content/abstract/scopus_id/84888056396","SCOPUS_ID:84888056396","Recent developments in biased agonism","Wisler, J.W.","Current Opinion in Cell Biology","09550674",,"27","18-24","2014-04-01","April 2014","10.1016/j.ceb.2013.10.008","0","Journal","re","Review"
"http://api.elsevier.com/content/abstract/scopus_id/84884272794","SCOPUS_ID:84884272794","Symptoms as Solutions: Hypnosis and Biofeedback for Autonomic Regulation in Autism Spectrum Disorders","Sugarman, L.I.","American Journal of Clinical Hypnosis","00029157",,"56","152-173","2014-04-01","April 2014","10.1080/00029157.2013.768197","0","Journal","ar","Article"
"http://api.elsevier.com/content/abstract/scopus_id/84884527646","SCOPUS_ID:84884527646","Investigating the effects of job demands and job resources on cabin crew safety behaviors","Chen, C.-F.","Tourism Management","02615177",,"41","45-52","2014-04-01","April 2014","10.1016/j.tourman.2013.08.009","0","Journal","ar","Article"
"http://api.elsevier.com/content/abstract/scopus_id/84886423686","SCOPUS_ID:84886423686","Antidiarrheal activities of isovanillin, iso-acetovanillon and Pycnocycla spinosa Decne ex.Boiss extract in mice","Sadraei, H.","Research in Pharmaceutical Sciences","17355362",,"9","83-89","2014-04-01","April 2014",,"0","Journal","ar","Article"
